{
  "plv.L1.xp_required": 0.0,
  "plv.L2.xp_required": 100.0,
  "plv.L3.xp_required": 250.0,
  "plv.L4.xp_required": 450.0,
  "plv.L5.xp_required": 700.0,
  "plv.L6.xp_required": 1000.0,
  "plv.L7.xp_required": 1350.0,
  "plv.L8.xp_required": 1750.0,
  "plv.L9.xp_required": 2200.0,
  "plv.L10.xp_required": 2700.0,
  "plv.L11.xp_required": 3300.0,
  "plv.L12.xp_required": 4000.0,
  "plv.L13.xp_required": 4800.0,
  "plv.L14.xp_required": 5700.0,
  "plv.L15.xp_required": 6700.0,
  "plv.L16.xp_required": 7800.0,
  "plv.L17.xp_required": 9000.0,
  "plv.L18.xp_required": 10300.0,
  "plv.L19.xp_required": 11700.0,
  "plv.L20.xp_required": 13200.0,
  "plv.L1.dmg_mult": 1.0,
  "plv.L2.dmg_mult": 1.04,
  "plv.L3.dmg_mult": 1.07,
  "plv.L4.dmg_mult": 1.1,
  "plv.L5.dmg_mult": 1.13,
  "plv.L6.dmg_mult": 1.16,
  "plv.L7.dmg_mult": 1.19,
  "plv.L8.dmg_mult": 1.22,
  "plv.L9.dmg_mult": 1.25,
  "plv.L10.dmg_mult": 1.28,
  "plv.L11.dmg_mult": 1.31,
  "plv.L12.dmg_mult": 1.34,
  "plv.L13.dmg_mult": 1.36,
  "plv.L14.dmg_mult": 1.39,
  "plv.L15.dmg_mult": 1.41,
  "plv.L16.dmg_mult": 1.43,
  "plv.L17.dmg_mult": 1.45,
  "plv.L18.dmg_mult": 1.47,
  "plv.L19.dmg_mult": 1.49,
  "plv.L20.dmg_mult": 1.5,
  "plv.L1.range_mult": 1.0,
  "plv.L2.range_mult": 1.02,
  "plv.L3.range_mult": 1.04,
  "plv.L4.range_mult": 1.06,
  "plv.L5.range_mult": 1.08,
  "plv.L6.range_mult": 1.1,
  "plv.L7.range_mult": 1.12,
  "plv.L8.range_mult": 1.14,
  "plv.L9.range_mult": 1.16,
  "plv.L10.range_mult": 1.17,
  "plv.L11.range_mult": 1.19,
  "plv.L12.range_mult": 1.2,
  "plv.L13.range_mult": 1.22,
  "plv.L14.range_mult": 1.23,
  "plv.L15.range_mult": 1.25,
  "plv.L16.range_mult": 1.26,
  "plv.L17.range_mult": 1.27,
  "plv.L18.range_mult": 1.28,
  "plv.L19.range_mult": 1.29,
  "plv.L20.range_mult": 1.3,
  "plv.L1.atk_speed_mult": 1.0,
  "plv.L2.atk_speed_mult": 1.02,
  "plv.L3.atk_speed_mult": 1.04,
  "plv.L4.atk_speed_mult": 1.06,
  "plv.L5.atk_speed_mult": 1.08,
  "plv.L6.atk_speed_mult": 1.1,
  "plv.L7.atk_speed_mult": 1.11,
  "plv.L8.atk_speed_mult": 1.13,
  "plv.L9.atk_speed_mult": 1.15,
  "plv.L10.atk_speed_mult": 1.16,
  "plv.L11.atk_speed_mult": 1.18,
  "plv.L12.atk_speed_mult": 1.19,
  "plv.L13.atk_speed_mult": 1.21,
  "plv.L14.atk_speed_mult": 1.22,
  "plv.L15.atk_speed_mult": 1.24,
  "plv.L16.atk_speed_mult": 1.25,
  "plv.L17.atk_speed_mult": 1.26,
  "plv.L18.atk_speed_mult": 1.27,
  "plv.L19.atk_speed_mult": 1.29,
  "plv.L20.atk_speed_mult": 1.3,
  "plv_max_level": 20.0
}